control_id,control_name,description,ai_act_article,ai_act_obligation,actor_role,risk_category,nist_ai_rmf,iso_42001,owasp_llm_top10,mitre_atlas,gdpr_article,dora_article,implementation_evidence,status,maturity_level,phase
AISEC-PH-004,Prohibited Practice - Real-Time Remote Biometric Identification,"Do not use real-time remote biometric identification systems in publicly accessible spaces for law enforcement except for exhaustively listed exceptions (missing children, specific criminal threats, terrorism).",Art. 5(1)(h),Prohibited,Deployer,Prohibited,GOVERN 1.7,A.2,—,—,Art. 9; Art. 10,—,project/risk_management/prohibited_checks.py,planned,1,Phase 1
AISEC-PH-005,Prohibited Practice - Predictive Policing (Individual),Do not use AI systems to make risk assessments of natural persons to predict the occurrence or reoccurrence of a criminal offence based solely on profiling or personality traits.,Art. 5(1)(d),Prohibited,Provider; Deployer,Prohibited,GOVERN 1.7,A.2,—,—,Art. 22,—,project/risk_management/prohibited_checks.py,planned,1,Phase 1
AISEC-PH-006,Prohibited Practice - Untargeted Facial Image Scraping,Do not use AI systems that create or expand facial recognition databases through untargeted scraping of facial images from the internet or CCTV footage.,Art. 5(1)(e),Prohibited,Provider; Deployer,Prohibited,GOVERN 1.7,A.2,—,—,Art. 9; Art. 10,—,project/risk_management/prohibited_checks.py,planned,1,Phase 1
AISEC-PH-007,Prohibited Practice - Emotion Inference in Workplace/Education,"Do not use AI systems to infer emotions of natural persons in the areas of workplace and education institutions, except for medical or safety reasons.",Art. 5(1)(f),Prohibited,Provider; Deployer,Prohibited,GOVERN 1.7,A.2,—,—,Art. 9,—,project/risk_management/prohibited_checks.py,planned,1,Phase 1
AISEC-PH-008,Prohibited Practice - Non-Consensual Intimate Imagery (Nudifiers),"Do not place on the market, put into service, or use AI systems that generate or manipulate sexually explicit or intimate images, video, or audio of real persons without explicit consent, or that create child sexual abuse material (CSAM). Systems must include reasonable safeguards against such use. Added by AI Omnibus (7 May 2026), effective 2 December 2026.",Art. 5 (AI Omnibus),Prohibited,Provider; Deployer,Prohibited,GOVERN 1.7,A.2,—,—,Art. 9; Art. 10,—,project/risk_management/prohibited_checks.py,planned,1,Phase 1
AISEC-GV-001,AI Literacy,Providers and deployers must take measures to ensure sufficient AI literacy of their staff and other persons dealing with the operation and use of AI systems.,Art. 4,Mandatory,Provider; Deployer,All,GOVERN 1.4; GOVERN 2.1,A.16; 7.2; 7.3,—,—,—,—,project/documentation/ai_literacy_program.md,planned,1,Phase 3
AISEC-GV-002,Authorized Representative,Non-EU providers must appoint an authorized representative established in the Union by written mandate before making their AI systems available on the Union market.,Art. 22,Mandatory,Provider,High-Risk,GOVERN 1.1,A.15,—,—,—,—,project/conformity_assessment/authorized_rep_guide.md,planned,1,Phase 5
AISEC-GV-003,Cooperation with Competent Authorities,Providers and deployers must cooperate with national competent authorities. Provide requested information and access. Participate in regulatory sandboxes if requested.,Art. 21; Art. 26(8),Mandatory,Provider; Deployer,High-Risk,GOVERN 1.1; GOVERN 1.3,A.15,—,—,—,Art. 19,project/conformity_assessment/authority_cooperation.md,planned,1,Phase 5
AISEC-GV-004,DORA ICT Risk Management Alignment,"For AI systems used in financial services, align AI Act requirements with DORA ICT risk management framework. Ensure AI-specific risks are covered in ICT risk management strategy.",—,Recommended,Provider; Deployer,High-Risk,GOVERN 1.1; MANAGE 1.1,A.3; A.4; A.12,—,—,—,Art. 5; Art. 6; Art. 7; Art. 8; Art. 9; Art. 10; Art. 11,project/risk_management/dora_alignment.md,planned,1,Phase 1
AISEC-GV-005,DORA Third-Party Risk for AI Vendors,Conduct ICT third-party risk assessment for AI system vendors and GPAI model providers as required by DORA. Include AI-specific risks in vendor due diligence.,—,Recommended,Deployer,High-Risk,GOVERN 1.5; MAP 3.4,A.12; A.13,LLM03:Supply Chain,AML.T0042,—,Art. 28; Art. 29; Art. 30,project/risk_management/dora_vendor_assessment.md,planned,1,Phase 1
AISEC-GV-006,DORA Digital Operational Resilience Testing for AI,Include AI systems in scope of DORA digital operational resilience testing. Apply threat-led penetration testing (TLPT) where AI systems support critical functions.,—,Recommended,Provider; Deployer,High-Risk,MEASURE 2.6; MANAGE 2.3,A.7; A.12,LLM01:Prompt Injection,AML.T0015; AML.T0043; AML.T0044,—,Art. 24; Art. 25; Art. 26; Art. 27,project/robustness_security/dora_resilience_testing.md,planned,2,Phase 4
AISEC-GV-007,GDPR Data Protection Impact Assessment for AI,Conduct DPIA for AI systems processing personal data that are likely to result in high risk to rights and freedoms. Integrate AI-specific risks into existing DPIA methodology.,—,Recommended,Provider; Deployer,High-Risk,GOVERN 1.6; MAP 5.1,A.3; A.4,—,—,Art. 35; Art. 36,—,project/risk_management/gdpr_dpia_ai.md,planned,1,Phase 1
AISEC-GV-008,GDPR Automated Decision-Making Safeguards,"For AI systems making automated decisions with legal or similarly significant effects on individuals, implement safeguards under GDPR Article 22: right to human intervention, right to express point of view, right to contest.",—,Recommended,Deployer,High-Risk,GOVERN 1.4; GOVERN 1.7,A.5; A.11,—,—,Art. 22; Art. 13(2)(f); Art. 14(2)(g); Art. 15(1)(h),—,project/human_oversight/gdpr_art22_safeguards.py,planned,1,Phase 4
AISEC-GV-009,Cross-Framework Incident Management,"Establish unified incident management process covering AI Act serious incident reporting (Art. 73), GDPR breach notification (Art. 33/34), and DORA major ICT incident reporting (Art. 19). Single triage with multi-regulatory routing.",—,Recommended,Provider; Deployer,High-Risk,MANAGE 4.2,A.14,—,—,Art. 33; Art. 34,Art. 19,project/post_market_monitoring/unified_incident_process.md,planned,2,Phase 5
